{
  "$schema": "functional-scenario.schema.json",
  "id": "shots-bouncy-nes-functional",
  "sampleId": "shots-bouncy",
  "target": "nes",
  "warmUpFrames": 20,
  "observationFrames": 240,
  "inputs": [],
  "checkpoints": [
    {
      "id": "pool-contract",
      "frame": 260,
      "expectedSignals": {
        "poolCapacity": 2,
        "requestCapacity": 2
      }
    }
  ],
  "expectedFeatures": {
    "gameplayTicks": true,
    "audioService": false,
    "cameraLifecycle": false,
    "background": true,
    "spriteOam": true,
    "bankRestoration": false,
    "safeVideoWrites": true
  },
  "audio": {
    "serviceExpectedByDefault": false,
    "authoredSilence": []
  },
  "budgetEvidence": {
    "baselineCommit": "95f166886713ff3b88bc1e17c03ef0ffe93d649a",
    "hardwareTimingRationale": "An NTSC NES frame publishes retained OAM at Video.WaitVBlank() before this sample runs shots.Draw(), shots.Request(), and shots.ProcessRequests(). A shot accepted after Draw cannot enter shadow OAM until the following Draw and is legally published at the next VBlank, so the retained-OAM contract allows two sampled frames without reordering Draw or request processing.",
    "productionTraceRationale": "The exact NES bouncing-shot ROM preserves the two-slot cap, dropped requests, floor-contact reversals, and retained-OAM visibility. GCP-2.1 records the two-frame draw-after-request phase contract so target addressing optimizations do not depend on accidental slower timing."
  },
  "budgets": {
    "minimumGameplayTickRatio": 0.95,
    "maximumConsecutiveMissedGameplayTicks": 1,
    "maximumSpawnToVisibleFrames": 2
  }
}
