{
  "$schema": "functional-scenario.schema.json",
  "id": "tiled-free-scroll-gb-functional",
  "sampleId": "tiled-free-scroll",
  "target": "gb",
  "warmUpFrames": 20,
  "observationFrames": 360,
  "inputs": [],
  "checkpoints": [
    { "id": "forward-diagonal-wrap-window", "frame": 120, "expectedSignals": { "user0": 112, "user2": 112, "user4": 1, "visibleCameraX": 111, "visibleCameraY": 111, "commitCount": 27 } },
    { "id": "reversed-diagonal-window", "frame": 200, "expectedSignals": { "user0": 98, "user2": 98, "user4": 0, "visibleCameraX": 98, "visibleCameraY": 98, "commitCount": 48 } },
    { "id": "origin-crossed-and-forward-again", "frame": 320, "expectedSignals": { "user0": 20, "user2": 20, "user4": 1, "visibleCameraX": 20, "visibleCameraY": 20, "commitCount": 77 } }
  ],
  "expectedFeatures": {
    "gameplayTicks": true,
    "audioService": false,
    "cameraLifecycle": true,
    "background": true,
    "spriteOam": false,
    "bankRestoration": true,
    "safeVideoWrites": true
  },
  "audio": {
    "serviceExpectedByDefault": false,
    "authoredSilence": []
  },
  "budgetEvidence": {
    "baselineCommit": "95f166886713ff3b88bc1e17c03ef0ffe93d649a",
    "hardwareTimingRationale": "A DMG frame is 70224 cycles. Diagonal packed preparation is serialized by axis, each resident edge remains immutable, and every VBlank commits at most one 19-tile column or 21-tile row.",
    "productionTraceRationale": "The retained red gate rejected the regressed roughly 74-of-90 production cadence. The longer exact-ROM window crosses row and column chunk groups plus circular background wrap without accepting that slowdown."
  },
  "budgets": {
    "minimumGameplayTickRatio": 0.95,
    "maximumConsecutiveMissedGameplayTicks": 1,
    "maximumRequestToResidentFrames": 2,
    "maximumRequestToVisibleFrames": 2
  }
}
