{
  "$schema": "functional-scenario.schema.json",
  "id": "static-drawing-gb-functional",
  "sampleId": "static-drawing",
  "target": "gb",
  "warmUpFrames": 4,
  "observationFrames": 60,
  "inputs": [],
  "checkpoints": [
    {
      "id": "scene-retained",
      "frame": 64,
      "expectedSignals": {
        "displayEnabled": 1
      }
    }
  ],
  "expectedFeatures": {
    "gameplayTicks": false,
    "audioService": false,
    "cameraLifecycle": false,
    "background": true,
    "spriteOam": false,
    "bankRestoration": false,
    "safeVideoWrites": true
  },
  "audio": {
    "serviceExpectedByDefault": false,
    "authoredSilence": []
  },
  "budgetEvidence": {
    "baselineCommit": "95f166886713ff3b88bc1e17c03ef0ffe93d649a",
    "hardwareTimingRationale": "DMG background VRAM is writable only while LCD is disabled or during VBlank. The retained scene must remain unchanged after startup.",
    "productionTraceRationale": "The production drawing source and tracked 32 KiB ROM retain the authored face and platform for every observed frame with no post-startup VRAM mutation."
  },
  "budgets": {
    "minimumGameplayTickRatio": 0,
    "maximumConsecutiveMissedGameplayTicks": 0
  }
}
