{
  "$schema": "functional-scenario.schema.json",
  "id": "tiled-vertical-scroll-gb-functional",
  "sampleId": "tiled-vertical-scroll",
  "target": "gb",
  "warmUpFrames": 20,
  "observationFrames": 600,
  "inputs": [],
  "checkpoints": [
    { "id": "forward-near-vertical-limit", "frame": 240, "expectedSignals": { "user0": 238, "user1": 1, "visibleCameraY": 237, "commitCount": 29 } },
    { "id": "reversed-after-authored-hold", "frame": 320, "expectedSignals": { "user0": 195, "user1": 0, "visibleCameraY": 196, "commitCount": 36 } },
    { "id": "returned-and-forward-again", "frame": 520, "expectedSignals": { "user0": 2, "user1": 1, "visibleCameraY": 1, "commitCount": 60 } }
  ],
  "expectedFeatures": {
    "gameplayTicks": true,
    "audioService": false,
    "cameraLifecycle": true,
    "background": true,
    "spriteOam": false,
    "bankRestoration": true,
    "safeVideoWrites": true
  },
  "audio": {
    "serviceExpectedByDefault": false,
    "authoredSilence": []
  },
  "budgetEvidence": {
    "baselineCommit": "95f166886713ff3b88bc1e17c03ef0ffe93d649a",
    "hardwareTimingRationale": "DMG provides 70224 cycles per frame and one immutable packed row commits within the 21-write VBlank ceiling; preparation and publication may each lag by at most one physical frame.",
    "productionTraceRationale": "The autonomous 600-frame production traversal covers upward movement, the authored hold, reversal, row-buffer wrap, and later chunk groups while retaining at least 95 percent gameplay cadence."
  },
  "budgets": {
    "minimumGameplayTickRatio": 0.95,
    "maximumConsecutiveMissedGameplayTicks": 1,
    "maximumRequestToResidentFrames": 1,
    "maximumRequestToVisibleFrames": 1
  }
}
