{
  "$schema": "functional-scenario.schema.json",
  "id": "tiled-free-scroll-nes-functional",
  "sampleId": "tiled-free-scroll",
  "target": "nes",
  "warmUpFrames": 20,
  "observationFrames": 360,
  "inputs": [],
  "checkpoints": [
    { "id": "forward-diagonal-nametable-window", "frame": 160, "expectedSignals": { "user0": 139, "user2": 139, "user4": 1, "visibleCameraX": 139, "visibleCameraY": 139 } },
    { "id": "reversed-diagonal-window", "frame": 200, "expectedSignals": { "user0": 109, "user2": 109, "user4": 0, "visibleCameraX": 109, "visibleCameraY": 109 } },
    { "id": "origin-crossed-and-forward-again", "frame": 320, "expectedSignals": { "user0": 11, "user2": 11, "user4": 1, "visibleCameraX": 11, "visibleCameraY": 11 } }
  ],
  "expectedFeatures": {
    "gameplayTicks": true,
    "audioService": false,
    "cameraLifecycle": true,
    "background": true,
    "spriteOam": false,
    "bankRestoration": true,
    "safeVideoWrites": true
  },
  "audio": {
    "serviceExpectedByDefault": false,
    "authoredSilence": []
  },
  "budgetEvidence": {
    "baselineCommit": "95f166886713ff3b88bc1e17c03ef0ffe93d649a",
    "hardwareTimingRationale": "The NTSC four-screen path serializes diagonal edge commits, prepares packed data outside NMI, and keeps every bounded row or column publication within VBlank.",
    "productionTraceRationale": "The 360-frame exact production traversal covers diagonal movement, row and column boundaries, nametable wrap, packed chunk changes, and the 16-bit reverse-safe source counter while retaining at least 95 percent gameplay cadence."
  },
  "budgets": {
    "minimumGameplayTickRatio": 0.95,
    "maximumConsecutiveMissedGameplayTicks": 1,
    "maximumRequestToResidentFrames": 1,
    "maximumRequestToVisibleFrames": 1
  }
}
