{
  "$schema": "functional-scenario.schema.json",
  "id": "tiled-vertical-scroll-nes-functional",
  "sampleId": "tiled-vertical-scroll",
  "target": "nes",
  "warmUpFrames": 20,
  "observationFrames": 600,
  "inputs": [],
  "checkpoints": [
    { "id": "holding-at-vertical-limit", "frame": 280, "expectedSignals": { "user0": 240, "user1": 1, "user2": 23, "visibleCameraY": 240 } },
    { "id": "reversed-after-authored-hold", "frame": 320, "expectedSignals": { "user0": 209, "user1": 0, "visibleCameraY": 210 } },
    { "id": "returned-and-forward-again", "frame": 560, "expectedSignals": { "user0": 31, "user1": 1, "visibleCameraY": 30 } }
  ],
  "expectedFeatures": {
    "gameplayTicks": true,
    "audioService": false,
    "cameraLifecycle": true,
    "background": true,
    "spriteOam": false,
    "bankRestoration": true,
    "safeVideoWrites": true
  },
  "audio": { "serviceExpectedByDefault": false, "authoredSilence": [] },
  "budgetEvidence": {
    "baselineCommit": "95f166886713ff3b88bc1e17c03ef0ffe93d649a",
    "hardwareTimingRationale": "The NTSC four-screen path prepares packed rows outside NMI and publishes at most one bounded row plus its attributes during VBlank.",
    "productionTraceRationale": "The 600-frame production traversal covers downward movement, the authored hold, reversal, four-screen row wrap, and later packed chunks while retaining at least 95 percent gameplay cadence."
  },
  "budgets": {
    "minimumGameplayTickRatio": 0.95,
    "maximumConsecutiveMissedGameplayTicks": 1,
    "maximumRequestToResidentFrames": 1,
    "maximumRequestToVisibleFrames": 1
  }
}
