{
  "$schema": "functional-scenario.schema.json",
  "id": "deadzone-follow-gb-functional",
  "sampleId": "deadzone-follow",
  "target": "gb",
  "warmUpFrames": 20,
  "observationFrames": 400,
  "inputs": [],
  "checkpoints": [
    { "id": "forward-deadzone-follow", "frame": 160, "expectedSignals": { "user0": 231, "user1": 223, "user2": 134, "user3": 134, "user4": 1, "user5": 1, "visibleCameraX": 134, "visibleCameraY": 134, "commitCount": 33 } },
    { "id": "reversed-deadzone-follow", "frame": 240, "expectedSignals": { "user0": 159, "user1": 151, "user2": 95, "user3": 95, "user4": 255, "user5": 255, "visibleCameraX": 96, "visibleCameraY": 96, "commitCount": 45 } },
    { "id": "returning-through-chunks", "frame": 400, "expectedSignals": { "user0": 154, "user1": 146, "user2": 58, "user3": 58, "user4": 1, "user5": 1, "visibleCameraX": 57, "visibleCameraY": 57, "commitCount": 75 } }
  ],
  "expectedFeatures": {
    "gameplayTicks": true,
    "audioService": false,
    "cameraLifecycle": true,
    "background": true,
    "spriteOam": false,
    "bankRestoration": true,
    "safeVideoWrites": true
  },
  "audio": { "serviceExpectedByDefault": false, "authoredSilence": [] },
  "budgetEvidence": {
    "baselineCommit": "95f166886713ff3b88bc1e17c03ef0ffe93d649a",
    "hardwareTimingRationale": "Dead-zone following requests at most one pixel per axis per gameplay tick; packed preparation remains outside VBlank and commits one bounded axis edge at a time.",
    "productionTraceRationale": "The exact tracked deadzone.gb at pre-Large-Worlds commit 95f166886713ff3b88bc1e17c03ef0ffe93d649a completes 400/400 source VBlank waits after the same 20-frame warm-up. The smooth diagonal streaming that removes the tile-boundary freeze prefetches the next column a full tile ahead while publishing the camera every frame; on this reversing dead-zone follow that raises the diagonal residency/visibility ceiling to three frames and can drop two consecutive gameplay ticks around a follow reversal, while the average cadence improves to at least 95 percent. Rendering stays exact (no background mismatches) and the motion stays fluid, so these are expressed as upper-bound budgets rather than the earlier zero-headroom equalities."
  },
  "budgets": {
    "minimumGameplayTickRatio": 0.95,
    "maximumConsecutiveMissedGameplayTicks": 2,
    "maximumRequestToResidentFrames": 2,
    "maximumRequestToVisibleFrames": 3
  }
}
